EPARegion,SNC,SDWDateLastFeaEPA,SDWDateLastFea,SignificantDeficiencyCount,DfrUrl,PrimarySourceDesc,SDWAContaminants,SDWDateLastVisit,PWSTypeCode,CountiesServed,SDWDateLastIeaEPA,SiteVisits5yrInspections,Ifea,StateCode,SDWDateLastIeaSt,GwSwCode,IndianCountry,ZipCodesServed,LeadAndCopperViol,FIPSCodes,SDWDateLastVisitEPA,Viopaccr,Vioremain,MaxScore,QtrsWithVio,VioFlag,RulesVio,PWSTypeDesc,SDWDateLastVisitLocal,Viortcfea,CitiesServed,Sansurvey5yr,PbViol,Viofeanot,CuAle,PopulationServedCount,Rc350Viol,MrFlag,SDWAContaminantsInViol3yr,OwnerDesc,PbAle,SDWDateLastFeaSt,OwnerTypeCode,PWSId,PWSActivityDesc,HealthFlag,PWSName,SeriousViolator,SiteVisits5yrAll,SDWA3yrComplQtrsHistory,PrimarySourceCode,TRIbalFlag,RulesVio3yr,QtrsWithSNC,PWSActivityCode,FeaFlag,CurrVioFlag,Viortcnofea,CuViol,OtherFlag,IeaFlag,NewVioFlg,SNCFlag,RegistryID,SDWAContaminantsInCurViol,SDWDateLastIea,Insp5yrFlag,PnFlag,Feas,SDWDateLastVisitState,SiteVisits5yrOther
09,No Violation,,,,https://echo.epa.gov/detailed-facility-report?sys=SDWIS&fid=GU0000009,Ground water,3100=Coliform (TCR),08/27/2015,CWS,Guam,,1,2,GU,01/13/2014,GW,N,,,66010,08/27/2015,0,0,1,4,1,0,Community water system,,,,,,,,7700,,No,,Federal government,,,F,GU0000009,Active,No,ANDERSEN AIR FORCE BASE WATER SYSTEM,No,1,VVVV________U,GW,0,1,0,A,0,0,,,No,1,No,0,110022811778,,01/13/2014,0,No,,,
09,No Violation,,,,https://echo.epa.gov/detailed-facility-report?sys=SDWIS&fid=GU0000017,Ground water purchased,3100=Coliform (TCR),,NTNCWS,Guam,,0,6,GU,02/26/2014,GW,N,,,66010,,0,0,1,0,0,0,Non-Transient non-community system,,,"DEDEDO, TAMUNING, TUMON",,,,,240,,No,,Private,,,P,GU0000017,Active,No,COCO PALM RESORT WATER SYSTEM,No,0,____________U,GWP,0,0,0,A,0,0,,,No,1,No,0,110053839664,,02/26/2014,0,No,,02/25/2013,
09,No Violation,,,,https://echo.epa.gov/detailed-facility-report?sys=SDWIS&fid=GU0000011,Ground water,8000=Revised Total Coliform Rule,,NTNCWS,Guam,,0,,GU,03/15/2013,GW,N,,,66010,,5,0,1,2,1,0,Non-Transient non-community system,,,MERIZO,,,,,115,,No,,Private,,,P,GU0000011,Active,No,COCOS ISLAND WATER SYSTEM,No,0,________VV__U,GW,0,1,0,A,0,0,5,,No,0,No,0,110053839600,,03/15/2013,0,No,,01/23/2013,
09,No Violation,,,,https://echo.epa.gov/detailed-facility-report?sys=SDWIS&fid=GU0000018,Ground water,,,NTNCWS,Guam,,0,,GU,,GW,N,,,66010,,0,0,1,0,0,0,Non-Transient non-community system,,,,,,,,500,,No,,State government,,,S,GU0000018,Active,No,GUAM INTERNATIONAL AIRPORT AUTHORITY,No,0,____________U,GW,0,0,0,A,0,0,,,No,0,No,0,110006365888,,,0,No,,,
09,No Violation,,,,https://echo.epa.gov/detailed-facility-report?sys=SDWIS&fid=GU0000015,Ground water,,,NTNCWS,Guam,,0,,GU,,GW,N,,,66010,,0,0,1,0,0,0,Non-Transient non-community system,,,TUMON,,,,,1050,,No,,Private,,,P,GU0000015,Active,No,GUAM PLAZA RESORT AND SPA WATER SYSTEM,No,0,____________U,GW,0,0,0,A,0,0,,,No,0,No,0,110064008595,,,0,No,,02/26/2013,
09,Serious Violator,,,,https://echo.epa.gov/detailed-facility-report?sys=SDWIS&fid=GU0000003,Surface water purchased,2456=Total Haloacetic Acids (HAA5); 2950=TTHM; 3100=Coliform (TCR); 5000=Lead and Copper Rule; 7500=Public Notice,,CWS,Guam,,0,28,GU,02/13/2014,SW,N,,,66010,,9,9,1,12,1,2,Community water system,,,"ADELUP, AGANA HEIGHTS, AGAT, ANIGUA, APRA HEIGHTS, ASAN, PIGO, PITI, SANTA RITA",,,,,22000,,Yes,5000=Lead and Copper Rule; 7500=Public Notice,State government,,,S,GU0000003,Active,No,GWA CENTRAL WATER SYSTEM,Yes,0,SSSSSSSSSSSSU,SWP,0,3,12,A,0,1,,,Yes,1,No,1,110013220497,5000=Lead and Copper Rule; 7500=Public Notice,02/13/2014,0,Yes,,,
09,In Violation,,,,https://echo.epa.gov/detailed-facility-report?sys=SDWIS&fid=GU0000006,Ground water,8000=Revised Total Coliform Rule,,CWS,Guam,,0,,GU,09/30/1985,GW,N,,,66010,,5,5,1,1,1,1,Community water system,,,"ADACAO, ADELUP, AGANA HEIGHTS, ANIGUA, ASAN, DEDEDO, PIGO, TALOFOFO, TAMUNING, TUMON",,,,,146050,,No,8000=Revised Total Coliform Rule,State government,,,S,GU0000006,Active,Yes,GWA NORTHERN WATER SYSTEM,No,0,___________VU,GW,0,1,0,A,0,1,,,No,0,No,0,110013220512,8000=Revised Total Coliform Rule,09/30/1985,0,No,,,
09,Serious Violator,,,,https://echo.epa.gov/detailed-facility-report?sys=SDWIS&fid=GU0000001,Surface water,2456=Total Haloacetic Acids (HAA5); 8000=Revised Total Coliform Rule,,CWS,Guam,,0,5,GU,02/22/2018,SW,N,,,66010,,10,10,1,4,1,1,Community water system,,,"TALOFOFO, UNATAC",,,,,6036,,No,8000=Revised Total Coliform Rule,State government,,,S,GU0000001,Active,Yes,GWA SOUTHERN WATER SYSTEM,Yes,0,________VVVSU,SW,0,1,1,A,0,1,,,No,1,No,1,110013119847,,02/22/2018,0,No,,09/28/1998,
09,No Violation,,,,https://echo.epa.gov/detailed-facility-report?sys=SDWIS&fid=GU0000010,Surface water,0200=Surface Water Treatment Rule; 3100=Coliform (TCR),,CWS,Guam,,0,4,GU,02/16/2014,SW,N,,,66010,,0,0,1,3,1,0,Community water system,,,"APRA HEIGHTS, GUAM NAVAL FACILITY, GUAM NAVAL MAGAZINE, GUAM NAVAL REGIONAL MEDICAL CE, GUAM NAVAL SHIP REPAIR FACILIT, GUAM NAVAL STATION, GUAM NAVAL SUPPLY DEPOT, NAVAL COMMUNICATIONS AREA MAST, NORTH TIPALAO, SOUTH TIPALAO, SUMAY",,,,,12500,,No,,Federal government,,,F,GU0000010,Active,No,U.S. NAVY WATER SYSTEM,No,0,VVV_________U,SW,0,2,0,A,0,0,,,No,1,No,0,110013120256,,02/16/2014,0,No,,,
